text,source,doc_type
"Version updated 20 March 2025 
4. WHEN AND HOW WE WILL SEND YOU STATEMENTS 
• We may provide you with the ability to view or download certain statements, if required by law, by making it available on 
our platform and it may be obtained by using one or more of the following interfaces or channels: Online, App, Automated 
Deposit Terminal (ADT), Automatic Teller Machine (ATM), Cell phone banking or at any of our branches. You may be 
charged for statements. In exceptional circumstances we may email statements at your request and at your own 
risk. 
• Your statement will reflect all the transactions on your solution for the period shown on the statement. Transactions 
carried out, but not yet cleared, paid, deducted from your solution will not appear on your statement for that statement 
period. You may view pending transactions on the App or website.  
• Certain information, including your account balance information that is made available to you on the interfaces  or",C:\Users\l\Documents\Banking-rag\data\product_terms\StandardTermsandConditions.pdf,product_terms
"period. You may view pending transactions on the App or website.  
• Certain information, including your account balance information that is made available to you on the interfaces  or 
channels may be delayed and may not show your recent transactions. You can confirm your account balance information 
by contacting us.  
5. YOU MUST CHECK YOUR STATEMENT CAREFULLY AND REPORT ANY MISTAKES 
• You must check each entry on your statement carefully as soon as you get your statement.  
• You must report any mistakes or transactions done without your permission to us within 30 calendar days from the date 
of the statement. Our contact details are available on our interfaces and channels. If you do not do this, we will treat 
the entries and transactions shown on the statement as correct or done by you or with your permission.  
• IMPORTANT: We will not be responsible for any loss or damage you suffer because you did not report errors or",C:\Users\l\Documents\Banking-rag\data\product_terms\StandardTermsandConditions.pdf,product_terms
"• IMPORTANT: We will not be responsible for any loss or damage you suffer because you did not report errors or 
unauthorised transactions in time. If you receive inContact notifications, you must report any unauthorised 
transactions to us immediately, without  any delay, to prevent further unauthorised transactions. If you do not 
do this, we can hold you responsible for those transactions.  
 
6. INCONTACT NOTIFICATIONS 
• inContact is a messaging service which provides you with notifications of certain account activity via App Push Notification 
to your selected mobile number via a direct message to your linked App or via email to your selected email address or 
via SMS to your selected mobile number. It is important that you read your inContact notifications as soon as you receive 
them.  
• In certain circumstances we will first try to send you a direct message via an App Push Notification, and if we cannot, we 
will send you an SMS or email.",C:\Users\l\Documents\Banking-rag\data\product_terms\StandardTermsandConditions.pdf,product_terms
"them.  
• In certain circumstances we will first try to send you a direct message via an App Push Notification, and if we cannot, we 
will send you an SMS or email.  
• inContact is designed to help you track activity on your account and minimise potential unauthorised transactions.  
• You may incur a fee for the inContact Notification Service. Kindly refer to our pricing guide located on our websites or 
Apps for the full fee structure.  
• The types and values of transactions that we provide notifications for do change from time to time. You must take the 
necessary precautions by safeguarding your solutions, accounts, cards, device  and access mechanisms, such as 
usernames, passwords, OTPs and PINs. You are responsible for ensuring that we have your correct mobile numbers 
and email addresses. Your inContact information may be updated through our interfaces or channels.",C:\Users\l\Documents\Banking-rag\data\product_terms\StandardTermsandConditions.pdf,product_terms
"and email addresses. Your inContact information may be updated through our interfaces or channels. 
• You must keep your inContact details i.e., your selected cell phone number and or email address up to date at all times.  
• We will not be held responsible if your SMS or email is sent to the wrong number or address.  
• We cannot guarantee receipt or delivery of an SMS or e -mail as we and you use external third parties (like your 
telecommunications provider) for relaying of SMS or e-mail. Although we do send you inContact notifications , your 
statement will be the main and final record of all transactions on your account.",C:\Users\l\Documents\Banking-rag\data\product_terms\StandardTermsandConditions.pdf,product_terms
"Version updated 20 March 2025 
• If there is a dispute about when a notification was sent, the records on our system will be proof of the date and 
time of the sending of the notification unless you can prove otherwise.   
• If you do not notify us of any unauthorised transaction, you agree that we can treat the transaction as correct 
and hold you legally responsible for the transaction as if you had done or approved it.  
• In the event of fraud, you must report the suspicious or unauthorised transactions to us immediately. We will investigate 
any loss that you suffered because of any suspicious or unauthorised transactions and it may be necessary, as part of 
our investigation, for you to supply us with certain information, including a police services or law enforcement agency 
case number. You must co -operate with us and the authorities  in any investigation  and provide us with accurate",C:\Users\l\Documents\Banking-rag\data\product_terms\StandardTermsandConditions.pdf,product_terms
"case number. You must co -operate with us and the authorities  in any investigation  and provide us with accurate 
information. We may refund you once it has been established that you suffered financial loss as a direct result of the 
fraud, but only if certain conditions are met, as determined by the specific solution agreement. This may include your 
negligent actions – like compromising your access credentials. 
o Note: This clause does not apply if the fraud or suspected fraud was committed by an authorised user 
or additional cardholder. 
• inContact subscribers can access Cell phone  Banking Lite by dialling *120*321# (note: airtime charges may apply) 
(applicable to South Africa only) . You can use it to monitor your account by viewing transactions and balances on all 
accounts linked to your profile and to perform limited transactions.  
• If you are registered for online banking or the App, your inContact number can be used to receive your OTP. Should your",C:\Users\l\Documents\Banking-rag\data\product_terms\StandardTermsandConditions.pdf,product_terms
"accounts linked to your profile and to perform limited transactions.  
• If you are registered for online banking or the App, your inContact number can be used to receive your OTP. Should your 
OTP and inContact numbers be different from each other you must maintain them individually. If your OTP number differs 
from your inContact number, your OTP number is not automatically updated when you change your inContact details.  
• If you are a Cell phone  Banking or inContact user and you notice anything suspicious you must also contact us 
immediately. Thereafter please also contact your service provider/network operator to report the suspicious activity e.g., 
SIM SWAP (a sudden loss of service can be an indication of a SIM SWAP).  
 
7. HOW WE TREAT YOUR PERSONAL INFORMATION (Privacy Term) 
• We may record all interactions with you to: 
o check that we carried out your instructions correctly and that we are meeting our regulatory obligations;",C:\Users\l\Documents\Banking-rag\data\product_terms\StandardTermsandConditions.pdf,product_terms
"• We may record all interactions with you to: 
o check that we carried out your instructions correctly and that we are meeting our regulatory obligations;  
o help detect or prevent fraud or other crimes; and  
o improve our services to you and other customers.  
• Your personal information (which, for the purposes of this term, includes special personal information) will be held by 
entities within the FirstRand group of companies. 
• To better understand the entities that form part of the FirstRand group of companies and how your personal information 
is treated, please refer to FirstRand’s Group Customer Privacy Notice which forms part of this privacy term. The privacy 
notice can be found on our Apps and websites or contact us to request a copy.  
• In this privacy term references to “we”, “us” or “our” are references to the entities in the FirstRand group of companies,",C:\Users\l\Documents\Banking-rag\data\product_terms\StandardTermsandConditions.pdf,product_terms
"• In this privacy term references to “we”, “us” or “our” are references to the entities in the FirstRand group of companies, 
and all affiliates, associates, cessionaries, delegates, successors in title or third parties (authorised agents and 
contractors), when such parties are acting as responsible parties or operators in terms of applicable privacy laws, unless 
stated otherwise. References to privacy related terminology used in this term (such as personal information and 
responsible party) should also be rea d as to incorporate any similar terminology used in the jurisdiction in which your 
personal information is processed. 
• By accepting these Standard T&Cs or by using any solution offered by us, you acknowledge that to:  
o conclude and fulfil contractual terms or obligations to you;",C:\Users\l\Documents\Banking-rag\data\product_terms\StandardTermsandConditions.pdf,product_terms
"Version updated 20 March 2025 
o comply with obligations imposed by law; or 
o protect or pursue your, our, or a third party’s legitimate interests, including offering solutions that best meet 
your needs, 
your personal information may be processed through centralised functions and systems across entities in the FirstRand 
group of companies as well as cross-border and may be used for the purposes, in the manner, and with the appropriate 
controls as set out in our privacy notice.  
• Where it is necessary to obtain consent for processing outside of this privacy term, we will explicitly seek your consent 
separately. 
• We want to ensure that you fully understand how your personal information may be used. We described the purposes 
for which your personal information may be used in detail in our privacy notice. We also set out further information about 
accessing, correcting or objecting to the processing of your personal information in our privacy notice. We strongly advise",C:\Users\l\Documents\Banking-rag\data\product_terms\StandardTermsandConditions.pdf,product_terms
"accessing, correcting or objecting to the processing of your personal information in our privacy notice. We strongly advise 
that you read our privacy notice, given its incorporation into your agreement with us and in these Standard T&Cs.  
• If you are a juristic person (for example, a company or a trust) it may also be necessary for the FirstRand group of 
companies to obtain personal information of parties who are related to your business or activity, such as members, 
directors, ultimate beneficial owners, shareholders or trustees (as applicable) and as set out in more detail in our privacy 
notice. 
• For the purposes of these Standard T&Cs, the responsible party is the party with whom you are contracting a solution 
(using a solution), as well as other entities in the FirstRand group of companies, which are listed in our privacy notice as 
responsible parties. For the contact details of these responsible parties, see our privacy notice.",C:\Users\l\Documents\Banking-rag\data\product_terms\StandardTermsandConditions.pdf,product_terms
"responsible parties. For the contact details of these responsible parties, see our privacy notice.  
8.  ADDRESSES FOR SENDING CORRESPONDENCE AND LEGAL NOTICES 
• We may communicate with you using any communication method.  
• We will send any communications to the contact details we have on record for you. We may also communicate with you 
using our platform interfaces and channels like our App or by means of a publication/advertisement in the media.  
• Legal documents and notices that we serve or deliver, will be served at your physical address/employment 
address/mortgaged property address/ registered address/ principal place of business/ last street address we have on 
record for you or your last known e -mail address or cell phone number as recorded on our system or the last known 
details we obtained. This is your chosen service address for legal documents and notices.",C:\Users\l\Documents\Banking-rag\data\product_terms\StandardTermsandConditions.pdf,product_terms
"details we obtained. This is your chosen service address for legal documents and notices.  
• You must send us any legal notices or summonses to the following address, which we choose as our domicilium: 
FirstRand Legal, 3rd Floor,4 Merchant Place, Corner Fredman Drive and Rivonia Road, Sandton, 2196 . [This address 
may differ for countries other than South Africa. Please refer to your solution agreement for an address in your country.] 
 
• You must immediately tell us if any of your contact details change. You can do this on our platform by making use of our 
unassisted and assisted interfaces and channels like visiting any branch or by calling our call centre. If you change your 
street address, you must give us proof of your new address. It may take up to 15  days for the change to reflect on our 
systems.  
 
• Where we may need to update your records, you agree that we may get your contact details from other companies in the 
FirstRand group of companies.",C:\Users\l\Documents\Banking-rag\data\product_terms\StandardTermsandConditions.pdf,product_terms
"systems.  
 
• Where we may need to update your records, you agree that we may get your contact details from other companies in the 
FirstRand group of companies.  
• Any correspondence we send to you will be considered to be delivered to you if:  
o delivered by hand during business hours (between 8h00 and 17h00) – on the date it was delivered.  
o posted by registered mail – at 10h00 on the fourth day after the post office issued the registration receipt.  
o posted by ordinary mail – at 10h00 on the fourth day after the document is posted.  
o sent by e-mail – on the date on which the document was e-mailed.",C:\Users\l\Documents\Banking-rag\data\product_terms\StandardTermsandConditions.pdf,product_terms
"Version updated 20 March 2025 
o sent by SMS or MMS – on the date on which the document was sent.  
o sent by printable webpage – on the date the page is displayed.  
o sent by instant message App Push Notification or messaging via platform – on the date of transmission.  
• Any notices or correspondence we make available on our website, App, our ATM network, our bank branches or in the 
media will be considered to have been received by you on the date it was published.  
• A notice actually received by you is considered delivered even if the delivery method or address is not aligned to this 
clause.  
9. INDIRECT INTERFACE OR CHANNEL INSTRUCTIONS 
• We make various interfaces and channels available to you and you have the right to choose which interface or channel 
you wish to use. 
• We take reasonable steps to incorporate various verification and other security checks and measures into all our",C:\Users\l\Documents\Banking-rag\data\product_terms\StandardTermsandConditions.pdf,product_terms
"you wish to use. 
• We take reasonable steps to incorporate various verification and other security checks and measures into all our 
interfaces and channels. However, direct interfaces  and channels (such as verified websites , cell phone banking and 
Apps) provide better protection to you than indirect and unsecured interfaces or channels (such as e-mail). We therefore 
encourage the use of direct interfaces or channels and discourage the use of indirect  interfaces or channels. Indirect 
interfaces and channels are methods of interaction that do not require identification and verification for interaction, like 
emails. 
• We make our indirect interfaces or channels available to you on the following basis only and you expressly acknowledge 
and agree that: 
o Indirect interfaces or channels carry various increased risks. For example, indirect communications 
can easily cause errors or can be intercepted, changed without your knowledge or consent or sent by",C:\Users\l\Documents\Banking-rag\data\product_terms\StandardTermsandConditions.pdf,product_terms
"can easily cause errors or can be intercepted, changed without your knowledge or consent or sent by 
unauthorised individuals claiming to provide instructions on your behalf. There are also many factors 
associated with indirect interfaces or channels which are beyond our control. By using indirect  
interfaces or channels, you accept these risks. 
• Whilst we will take reasonable steps to verify the instructions we receive via indirect interfaces or channels: 
o we cannot provide any assurances in this regard, nor can we guarantee that our checks will prevent 
fraud. You bear the risk of fraud. 
o you alone are responsible for ensuring that we receive your instructions and that they are correct. 
o we will only be deemed to have received an instruction once we have confirmed receipt in writing  or over 
telephone. For clarity (but by way of example only), if an instruction is received more than once, or not at all,",C:\Users\l\Documents\Banking-rag\data\product_terms\StandardTermsandConditions.pdf,product_terms
"telephone. For clarity (but by way of example only), if an instruction is received more than once, or not at all, 
or late, or in error, or if it contains inaccuracies, we cannot be held responsible. 
• You will have no claim against us for any loss or damage of any nature that you may suffer due to the use of 
indirect interfaces or channels, and you waive any such claim, except where such loss or damage was caused 
by our gross negligence. 
• You hereby indemnify and hold us harmless against any claim of any nature which you or any third party may 
have, relating to the use of indirect interfaces or channels, except where such claim arises due to our gross 
negligence. 
10. SECURE CHAT AND CALL 
• You can use Secure Chat on our Apps which allows users to chat with users or with us. Secure Chat may not be available 
on all Apps or in all countries. 
• Secure Chat is available to the account holders of qualifying accounts who additionally may have the authority to mandate",C:\Users\l\Documents\Banking-rag\data\product_terms\StandardTermsandConditions.pdf,product_terms
"on all Apps or in all countries. 
• Secure Chat is available to the account holders of qualifying accounts who additionally may have the authority to mandate 
advisors to perform transactions on their behalf.",C:\Users\l\Documents\Banking-rag\data\product_terms\StandardTermsandConditions.pdf,product_terms
"Version updated 20 March 2025 
• You can only use Secure Chat if you meet the eligibility criteria  and continue to comply with our solution agreements; 
applicable laws; regulations and industry rules.  
• There is currently no fee for the use of the Secure Chat service; however, we reserve the right to charge a fee at a later 
stage.  
• We do not assume liability for loss; whether direct or indirect; or damage which you may suffer from using the 
service such as loss or damage resulting from typographical errors, duplicate instructions or delayed messages 
due to a loss of connectivity not occasioned by us. 
• Users of Secure Chat services must be 18 years of age or older or a major.   
• Licence (relevant to the intellectual property held) : With respect to your chats, you grant us a non -exclusive, perpetual 
(i.e., everlasting), world -wide, royalty free, irrevocable (i.e., irreversible), fully sub -licensable and non -exclusive license",C:\Users\l\Documents\Banking-rag\data\product_terms\StandardTermsandConditions.pdf,product_terms
"(i.e., everlasting), world -wide, royalty free, irrevocable (i.e., irreversible), fully sub -licensable and non -exclusive license 
to use, reproduce, modify, adapt, publish, translate, create derivative works from, di stribute and display such posts 
throughout the world in any media. 
 
• All chats will be between you and the other user only and we are not a party to the chats unless you are having a chat 
with our representatives. 
 
• While we may be capable of retrieving specific details of a chat, a retrieval can only be initiated based on a subpoena 
or to adhere to  our Information Manual prepared in accordance with Section 51 of the  South African Promotion of 
Access to Information Act  2 of 2000 or in terms if similar manuals or enabling legislation in the relevant country 
where we are established. 
 
• You must notify us immediately if you become aware of any unauthorised chat which are attributed to your profile. You",C:\Users\l\Documents\Banking-rag\data\product_terms\StandardTermsandConditions.pdf,product_terms
"where we are established. 
 
• You must notify us immediately if you become aware of any unauthorised chat which are attributed to your profile. You 
can notify us using the contact details on our Apps or websites. 
 
• Violation of these Standard T & Cs may lead to the immediate removal of all your chats, irrespective of your 
individual chats' compliance with these Standard T & Cs , without notice, warning or explanation to you and 
could also lead to you not being allowed to use the Secure Chat services. 
 
• We will fully co-operate with any law enforcement authorities or court order requiring us to disclose the identity or other 
details of any person whose chats are in breach of these Standard T & Cs. 
 
11. ELECTRONIC VOUCHERS AND REDEMPTION OF DISCOUNT BENEFITS  
• Certain third parties offer electronic discounts on certain products or services via their computer system from time to time",C:\Users\l\Documents\Banking-rag\data\product_terms\StandardTermsandConditions.pdf,product_terms
"11. ELECTRONIC VOUCHERS AND REDEMPTION OF DISCOUNT BENEFITS  
• Certain third parties offer electronic discounts on certain products or services via their computer system from time to time 
for redemption against products or services purchased.  We offer qualifying users the opportunity to receive these 
discounts when paying with their qualifying accounts or cards. The qualifying cards may change from time to time and 
you are encouraged to ensure that you check our interfaces and channels periodically for updates.  
 
• We do not distribute nor endorse any products or services to which the discounts apply.  Should you have any 
issues either with the service or product purchased you need to liaise with the relevant third -party where the 
purchase was made. We do not have any control over the products or services that the discounts are offered for 
and cannot be held liable for the unavailability of these products  or services in any way. Complaints regarding",C:\Users\l\Documents\Banking-rag\data\product_terms\StandardTermsandConditions.pdf,product_terms
"and cannot be held liable for the unavailability of these products  or services in any way. Complaints regarding 
quality or quantity of the products purchased must be directed to the third -party concerned. Whilst we make 
every endeavour to ensure the accuracy of the discount offered, changes may be implemented from time to time.  
We do not accept any responsibility for any loss which may arise from accessing or reliance on the information 
from a third-party and to the extent permitted by law, we exclude all liability for loss or damages direct or indirect 
arising from use of this service. The service is a value-added service, and no fees are charged for the redemption 
of the discounts or benefits.",C:\Users\l\Documents\Banking-rag\data\product_terms\StandardTermsandConditions.pdf,product_terms
"Version updated 20 March 2025 
12. AUTHORISED USERS 
• We will allow another person to act on you r behalf and to use, transact and access your solutions if you followed our 
prescribed process to give that person such authority. This includes the submission of know-your-client information about 
the authorised user, submission of relevant resolutions, authorisations or appointments of agents related to the authorised 
user, acceptance of terms and conditions applicable by the authorised user  and our verification and confirmation of the 
information and final acceptance of the authorised user. We refer to these persons as authorised users. 
• Anything done by your authorised user will be regarded as your actions or transactions and you will be liable 
for consequences of those actions or transactions. 
• You will be responsible for all debts authorised users incur including fees and charges, any overdrawn amounts",C:\Users\l\Documents\Banking-rag\data\product_terms\StandardTermsandConditions.pdf,product_terms
