text,source,doc_type
"FirstRand Bank Limited is an Authorised Financial Services and Credit Provider (NCRCP20). Reg. No. 1929/001225/06  
 
REMOTE BANKING AGREEMENT  
24 JUNE 2021 
 
 
 
 
This important document sets out the rights and duties between you and First National Bank 
(FNB) and Wesbank, divisions of FirstRand Bank Limited, with registration number 
1929/001225/06 (“the Bank”) in relation to the use of the Bank’s self -service interfaces which 
may be branded as interfaces from FNB, Wesbank and RMB Private Bank. This agreement 
applies to you if you use any of the following self service Banking interfaces: Online Banking, 
Cellphone Banking, .mobi, the Banking App . Read this document carefully. You must contact 
the Bank if you do not understand any part of this document. 
 
 
 
 
 
 
 
 
 
 
 
 
 
 
 
In this agreement, the following words will have the following meanings:",C:\Users\l\Documents\Banking-rag\data\agreements\Remote-Banking-Agreement.pdf,agreements
"the Bank if you do not understand any part of this document. 
 
 
 
 
 
 
 
 
 
 
 
 
 
 
 
In this agreement, the following words will have the following meanings: 
 
The words, “you” or “your” means the account holder and their authorised user/s. An authorised user is any person/s the account holder 
appoints to use the self service interfaces on their behalf (e.g. to do transactions).  
 
The words “us,” “we” or “our” me ans the Bank. Before you can use the self - service interfaces which include Online Banking, Cellphone 
Banking, the Banking App and .mobi ( collectively called “self- service” interfaces) 
 
If you are younger than 18, you must get your parent’s or legal guardian’s consent to use the self service interfaces. 
When does this agreement start? 
This agreement starts as soon you do any of the following: 
• register to use any of the service interfaces; 
• get access to be able to use any of the service interfaces; 
• actually use any of the service interfaces;",C:\Users\l\Documents\Banking-rag\data\agreements\Remote-Banking-Agreement.pdf,agreements
"• register to use any of the service interfaces; 
• get access to be able to use any of the service interfaces; 
• actually use any of the service interfaces; 
 
1. THIRD PARTY RELATIONSHIPS AND ADDITIONAL TERMS AND CONDITIONS 
(a) Other terms & conditions that also apply to you 
This agreement applies along with the other terms & conditions of the Bank that govern your accounts, our services and our 
relationship with you.  Certain of the products and services that we make available to you on the service interfaces, including 
those provided by third parties , may have their own terms & conditions.   These third party se rvices providers may include 
prepaid service providers;  Lottery service providers; Broadcaster and streaming services; Retail service providers; Technology 
and Smart device providers etc. if applicabl e. You must read this agreement together with all these  other relevant terms &",C:\Users\l\Documents\Banking-rag\data\agreements\Remote-Banking-Agreement.pdf,agreements
"and Smart device providers etc. if applicabl e. You must read this agreement together with all these  other relevant terms & 
conditions if applicable. The Bank will not be liable for any delays in respect of third party providers.  Your use of the third party 
service means that you accept and will be subject to the terms and conditions associated with it.  If you do not accept th ose 
terms and conditions you are advised not to make use of the service. 
 
 
(b) Which agreement applies in instances of conflict  
If there is a conflict (difference) between this agreement and any other  product terms & conditions, the provisions of th is 
agreement will apply;  unless the conflict relates to the use of the third party products or services, in which case, their terms and 
conditions will apply. 
 
 
Remote Banking Terms and Conditions 
Date last amended: June 2021 
 
 
Revision History: June 2021 
 
• Amendment to introduction",C:\Users\l\Documents\Banking-rag\data\agreements\Remote-Banking-Agreement.pdf,agreements
"conditions will apply. 
 
 
Remote Banking Terms and Conditions 
Date last amended: June 2021 
 
 
Revision History: June 2021 
 
• Amendment to introduction  
 Removal of If you are a Discovery Banking customer, this document sets out the rights and duties between you 
 and Discovery Holdings Limited with registration number 1999/007789/06 (Discovery) in relation to the use of the 
 Bank’s self -service interfaces subject to the services offered by FirstRand Bank on behalf of Discovery . Any 
 reference to the Bank must be read to include Discovery.",C:\Users\l\Documents\Banking-rag\data\agreements\Remote-Banking-Agreement.pdf,agreements
"FirstRand Bank Limited is an Authorised Financial Services and Credit Provider (NCRCP20). Reg. No. 1929/001225/06  
 
REMOTE BANKING AGREEMENT  
24 JUNE 2021 
 
(c) We are not responsible for links to third party sites, its content or for the third party’s actions or omissions, or its 
goods or services 
For your convenience only, the service interfaces may allow you to view or access third p arty websites or content or purchase 
content, products or services provided by third parties.   Even though we may make third party websites, content or products or 
services available to you, we do not endorse or recommend the third party or its products or  services. You alone are 
responsible for deciding whether the third party or its products or services meet your requirements. Terms and conditions and  
rules may apply to those products and form an agreement between you and the third party.",C:\Users\l\Documents\Banking-rag\data\agreements\Remote-Banking-Agreement.pdf,agreements
"rules may apply to those products and form an agreement between you and the third party.  
 
You alone are responsible for obtaining the terms and conditions or rules that apply to you and the products or services offered 
by the third party. The categories/ types of third parties whose products, services or offerings may be available from or 
associated to the s ervice interfaces may vary from time to time. They may include lotto service providers; coupon providers; 
voucher catalogue providers and other subscription providers. We have no control over such third parties or their products or  
services. We are not a p arty to any disputes between you and the third party. You alone are responsible for ensuring that any 
transactions you make on these third party sites are lawful. Some services are only available to persons who are 18 years old or 
older.",C:\Users\l\Documents\Banking-rag\data\agreements\Remote-Banking-Agreement.pdf,agreements
"transactions you make on these third party sites are lawful. Some services are only available to persons who are 18 years old or 
older.  
 
We are not respo nsible to you for any loss or damage you suffer, whether directly or indirectly, because of a third party or its 
products or services or your use of the products or services. You alone take the risk of using or purchasing third party prod ucts 
or services. You hereby agree to indemnify us and hold us harmless for any loss or damage you may suffer, or cause, in this 
regard.  
 
 
2. ELECTRONIC VOUCHERS AND REDEMPTION OF DISCOUNT BENEFITS  
 
Certain third parties offer electronic discounts on certain products via their computer system from time to time for redemption 
against products purchased.  The Bank offe rs qualifying Bank customers the opportunity to receive these discounts when 
paying with their qualifying cheque, debit or credit cards.  The qualifying cards may change from time to time and you are",C:\Users\l\Documents\Banking-rag\data\agreements\Remote-Banking-Agreement.pdf,agreements
"paying with their qualifying cheque, debit or credit cards.  The qualifying cards may change from time to time and you are 
encouraged to ensure that you check these terms and conditions periodically for upd ates.You are advised to read the se terms 
and conditions carefully.   
 
The Bank does not distribute nor endorse any products or servi ces to which the discounts apply.  Should you have any issues 
either with the service or product purchased you need to liaise with the relevant third party store at which the purchase was  
made.The Bank does not have any control over the products that the d iscounts are offered for and cannot be held liable for the 
unavailability of these products in any way.  Complaints regarding quality or quantity of the merchandise purchased must be 
directed to the third party concerned.  Whilst we make every endeavor to e nsure the accuracy of the discount offered, changes",C:\Users\l\Documents\Banking-rag\data\agreements\Remote-Banking-Agreement.pdf,agreements
"directed to the third party concerned.  Whilst we make every endeavor to e nsure the accuracy of the discount offered, changes 
may be implemented from time to time.  The Bank does not accept any responsibility for any loss which may arise from 
accessing or reliance on the information from the a third party and to the fullest exte nt permitted by South African law, we 
exclude all liability for loss or damages direct or indirect arising from use of this service. 
The service is a value added service and no fees are charged for the redemption of the coupons. 
 
 
 
3. ACCESS TO THE INTERFACES  AND SECURITY  
(a) Steps you must take to protect yourself  
NOTE: Information that is sent over an unsecured link or communication system can be unlawfully monitored, intercepted, or 
accessed.  While we take all reasonable steps to prevent this from happening, you need to understand that this risk exists.",C:\Users\l\Documents\Banking-rag\data\agreements\Remote-Banking-Agreement.pdf,agreements
"accessed.  While we take all reasonable steps to prevent this from happening, you need to understand that this risk exists. 
 
You play an important role in pro tecting yourself against fraud. For your safety you must follow the security 
tips/recommendations we give you on the service interfaces from time to time. You must also read the tips published at the 
Bank’s Security Centre on the Banking App and the online Banking Communications Page. You must (where applicable) log off 
from the service interface when you have finished transacting. The Bank recommends that you do not use public 
communication facilities such as internet café’s, but when you do, you must take special care . It is your responsibility to ensure 
that you have the necessary anti virus or anti-malware software on your device 
 
  
If you are a cellphone Banking or inContact customer and you notice anything suspicious you must also contact your service",C:\Users\l\Documents\Banking-rag\data\agreements\Remote-Banking-Agreement.pdf,agreements
"If you are a cellphone Banking or inContact customer and you notice anything suspicious you must also contact your service 
provider/network operator to rep ort the sus picious activity e.g. SIM Swaps (a sudden loss of service can be an indication of a 
SIM SWAP). Please take note of the following contact details for SIM Swop  
- MTN             083 123 STOP (123 7867)                                                   - CellC                      084 140 
- Vodacom     082 135                  - Virgin Mobile        0741 000 123 
- FNB Connect Dial 147 from an FNB SIM or call 087 575 0147 from any other line 
 
(b) For your protection and security you must enter the correct access information to identify yourself whenever you log onto the 
service interfaces. Since we deal with each other in a non-face to face environment, for your security you will need to enter the",C:\Users\l\Documents\Banking-rag\data\agreements\Remote-Banking-Agreement.pdf,agreements
"service interfaces. Since we deal with each other in a non-face to face environment, for your security you will need to enter the 
correct access information or take any other steps acceptable to us for us to verify your identity and the electronic 
communications you send us using the service interfaces each time you logon to the service interfaces. This is known as",C:\Users\l\Documents\Banking-rag\data\agreements\Remote-Banking-Agreement.pdf,agreements
"FirstRand Bank Limited is an Authorised Financial Services and Credit Provider (NCRCP20). Reg. No. 1929/001225/06  
 
REMOTE BANKING AGREEMENT  
24 JUNE 2021 
“authentication”. Access information includes access credentials, or Cellphone Banking personal identification number ( “mobile 
pin” or “MOPIN”). To protect you, we can refuse to act on any instructions you send us or can cancel your access (temporarily 
or permanently) if you don’t meet the authentication requirements. This includes where you enter the wrong access information. 
We may require of an additional layer authenctication for certain transactions  this may include  transactions where a unique 
number (OTP or one time PIN) is sent to your device before the transaction ca n be completed . Similarly, when a n instant 
message sent to your Banking App to request authorisation for the transaction or activity.  Take note: You can have the OTP",C:\Users\l\Documents\Banking-rag\data\agreements\Remote-Banking-Agreement.pdf,agreements
"message sent to your Banking App to request authorisation for the transaction or activity.  Take note: You can have the OTP 
sent to your inContact number or a separate mobile number of your choice. A loss of signa l to your OTP or inContact 
number can indicate a SIM SWAP and notify the Bank immediately as a precaution and to minimise any loss. 
 
Customers who have a linked Banking App will not receive an OTP via sms  but a notification via IM (instant messaging) via the 
Banking App requesting you to approve or decline the transaction.   We cannot guarantee receipt or delivery of an SMS and/or 
e-mail as the Bank is dependent on third parties such as your chosen Mobile N etwork operator, for relaying of SMS and/or e -
mail.  
 
The inContact Service is a messaging system which provides you with notifications of certain account activity by sending a 
message to your selected Mobile number and/or email to your email address and/o r, IM (Instant Message) to linked Banking",C:\Users\l\Documents\Banking-rag\data\agreements\Remote-Banking-Agreement.pdf,agreements
"message to your selected Mobile number and/or email to your email address and/o r, IM (Instant Message) to linked Banking 
App. Please be advised that we will initially attempt to deliver an IM to your linked Banking App, failing which we will send  
through an SMS and finally if those are unsuccessful we will send through e -mail notification(if applicable). This is due to the 
relative safety of the IM communication mechanism, as these are delivered directly to a single user’s App. IM is also not 
susceptible to the risk of a sim swop. 
 
(c) You are responsible for making sure you have the necessary equipment and software to use the service interfaces 
To be able to access the service interface/s you must have the necessary hardware, software and access to third -party 
communication services. You will be responsible for paying the cost of this and  the cost of any upgrades that you require.  To",C:\Users\l\Documents\Banking-rag\data\agreements\Remote-Banking-Agreement.pdf,agreements
"communication services. You will be responsible for paying the cost of this and  the cost of any upgrades that you require.  To 
access online banking you need to have access to a computer that has an active account with an Internet Service Provider 
(ISP) and an Internet browser software program. To access cellphone banking you need to be activated via your cellphone and 
cellphone network service provider. In order to use the  FNB Banking App you must ensure that you have a compatible 
smartphone and access to data.  You will be responsible for paying the relevant cellphone and/or network service provider 
charges that you incur when using the service channel.  You are responsible for the equipment you use to access the service 
interfaces. We have no control over the equipment, software or service providers. We are not responsible for any error or delay 
that may arise as a result and are also not responsible if you are unable to access the service interfaces because of your",C:\Users\l\Documents\Banking-rag\data\agreements\Remote-Banking-Agreement.pdf,agreements
"that may arise as a result and are also not responsible if you are unable to access the service interfaces because of your 
equipment, software or services provided to you by third parties.  It is your responsibility to ensure that you have the necessary 
anti virus or anti-malware software on your device 
 
(d) We are entitled to act on and accept all transactions done after your access credentials have been entered or applied 
 
All electronic communications that are sent to us during a logged in session will be treated as valid and authentic (i.e. after you 
have met our authentication requirements and are logged in to an interface) . This means that these electronic communications 
will have the same legal effect as written and signed paper communications from you. Since we deal with you non-face-to-face 
we will act on and accept all instructions or transactions done after your correct access c redentials have been entered and you",C:\Users\l\Documents\Banking-rag\data\agreements\Remote-Banking-Agreement.pdf,agreements
"we will act on and accept all instructions or transactions done after your correct access c redentials have been entered and you 
meet the verification requirements set by us . We will assume that all such transactions have been authorised by you, even if 
such transactions took place without your knowledge or consent or were not authorised  by you . This will not apply to 
transactions that occur after you have requested that we cancel your access credentials.  
 
You must never reveal your access credentials to anyone under any circumstances.  This includes when you use third party 
applications (apps) and sites. Certain financial aggregation apps (such as apps that help you track your spending across 
different financial institutions) may ask you to enter your access details to use their service.  Take note that if you do so  you put 
yourself at risk. In addition third parties will be able to access information ab out your accounts, banking history and other",C:\Users\l\Documents\Banking-rag\data\agreements\Remote-Banking-Agreement.pdf,agreements
"yourself at risk. In addition third parties will be able to access information ab out your accounts, banking history and other 
confidential information. You use such sites and apps at your own risk. If you are defrauded because you used a third party 
app or site the Bank will treat this as a voluntary compromise of your access details a nd confidential information and will not be 
legally responsible to you or any other person for any loss or damage you or they suffer.  
 
 
(e) Authorised Users act on your behalf as your agent 
By allowing an authorised user to access your account using the service channel, you give that person the authority to act as  
your agent. This means that anything the authorised user does or doesn’t do will be attributed to you. In other words their 
actions or failure to act (omission) will be considered by us as your actions or failure to act (omission).",C:\Users\l\Documents\Banking-rag\data\agreements\Remote-Banking-Agreement.pdf,agreements
"actions or failure to act (omission) will be considered by us as your actions or failure to act (omission).  
(f)  Steps you must take to protect your access information (access credentials, cards and equipment) 
Your access information is the only way we can know you are who you say you are when you transact, you must keep your 
access information secret and safe and you must not allow anybody to use your access information. You must never give or 
show your access information to any person, including any person who is an employee of the Bank or claiming to 
work for or represent us in any way. You must never respond to requests to enter or “confirm” your access 
credentials, sent to you via an email, SMS or instant me ssage. This is known as “phishing” where the sender tries to 
trick you into giving them your confidential information by pretending a communication was sent from us. The Bank",C:\Users\l\Documents\Banking-rag\data\agreements\Remote-Banking-Agreement.pdf,agreements
"trick you into giving them your confidential information by pretending a communication was sent from us. The Bank 
will NEVER ask you to give us your sensitive secret information, including access credentials by email, SMS, instant 
message or even over the telephone. If you respond to these “phishing” messages and lose money as a result of 
doing so, the Bank will not refund you.",C:\Users\l\Documents\Banking-rag\data\agreements\Remote-Banking-Agreement.pdf,agreements
"FirstRand Bank Limited is an Authorised Financial Services and Credit Provider (NCRCP20). Reg. No. 1929/001225/06  
 
REMOTE BANKING AGREEMENT  
24 JUNE 2021 
 
Take note: For your convenience, the same login or access credentials can be used to access different electronic interfaces, 
this is the case for Online Banking and the Banking App.  This means that if your access credentials are disclosed to someone 
else you can be defrauded across all the electronic interfaces which can e xpose you to greater losses.  You must immediately 
contact the Bank if you know or even  suspect that your access credentials have been compromised  to ensure that 
your loss is minimised.  
 
(g)  Additionally if you suffer a sudden loss of service on your mobile device contact the Bank immediately.  
 
You must ensure that your device/s which you use for transacting is always in your possession and protected with an additiona l",C:\Users\l\Documents\Banking-rag\data\agreements\Remote-Banking-Agreement.pdf,agreements
"You must ensure that your device/s which you use for transacting is always in your possession and protected with an additiona l 
access code, password or pattern lock.  Should your device to which your Banking Ap p is linked is no longer in your possession 
either permanently (for eg. due to theft, loss or in the event that you have sold it) or temporarily (your device is being re paired) 
you must contact the Bank immediately and or delink your Banking App immediately. 
 
If you receive suspicious communications (including emails, SMSs) call the Bank’s Fraud Team on 087 575 9444 or report via 
the FNB App/Online Banking.  For immediate action and assistance, we recommend that you call the Fraud Team. Please 
include your name and number in your email in case we need more information from you. RMB customers can contact the Bank 
or service centre on 0860 674 446.Standard Network Rates Apply.",C:\Users\l\Documents\Banking-rag\data\agreements\Remote-Banking-Agreement.pdf,agreements
"include your name and number in your email in case we need more information from you. RMB customers can contact the Bank 
or service centre on 0860 674 446.Standard Network Rates Apply.  
 
You must not keep your access credentials together with your access cards or other Banking documents. Do not store your 
access credentials  on the equipment you use to access the Bank service interfaces. For exampl e, never store your PIN or 
Cellphone Banking PIN  on, with or near your cellphone, computer, and telephone or with your e -Reg C ard or Telephone 
Banking Card.  For security purposes, we recommend that you memorise your access credentials. You must also follow the tips 
published on the Bank’s Security Centre  or Online Banking Communications Page.  You are not allowed to  register for the 
service or access the service channel using someone else’s access information or personal information.",C:\Users\l\Documents\Banking-rag\data\agreements\Remote-Banking-Agreement.pdf,agreements
"service or access the service channel using someone else’s access information or personal information.  
 
(g)You must IMMEDIATELY ask us to cancel your access code(s) if you suspect or know that your access code(s) have 
been lost, stolen or may be used without your permission. 
Prompt notification is the best way of keeping your losses to a minimum , you must tell us immediately if you suspect or know 
that your access information has been lost, stolen or compromised (might be used wit hout your permission). In instances 
whereby you suspect or know that your access code(s) have been lost, stolen or may be used without your permission, c all the 
Bank’s Fraud Team on 087 575 9444. RMB customers can contact the Bank or service centre on 0860 674 446. 
 
If there is a dispute about whether or when you told us to cancel your access code (s), it will be your responsibility to prove how",C:\Users\l\Documents\Banking-rag\data\agreements\Remote-Banking-Agreement.pdf,agreements
