text,source,doc_type
"for consequences of those actions or transactions. 
• You will be responsible for all debts authorised users incur including fees and charges, any overdrawn amounts 
plus interest on those amounts. You will be responsible for anything they do or fail to do. 
• There is risk involved in appointing someone else as your authorised user. You must consider if restrictions or limits must 
apply. 
• You must provide correct and up to date information about the authorised users. You are responsible for deciding and 
checking what rights must be given to authorised users. 
• You must immediately notify us of any changes to your authorised user on the relevant interface. The changes will be 
effective when we update our records  which may take up to 30  calendar days. There might be legal requirements that 
must be met before a newly appointed authorised user can transact, e.g., know your customer requirements  and 
resolutions.",C:\Users\l\Documents\Banking-rag\data\product_terms\StandardTermsandConditions.pdf,product_terms
"must be met before a newly appointed authorised user can transact, e.g., know your customer requirements  and 
resolutions. 
• You can cancel an authorised user’s rights at any time.  You will be liable for all actions of an authorised user until our 
process to remove the authorised user has been finalised, including any future dated payments. 
• The rights you gave to any authorised user will also come to an end where the law requires it, such as on your death or 
if you become legally incompetent or by court order. 
 
13. EVENTS BEYOND OUR CONTROL 
• At certain times, we may be prevented from providing solutions to you or fulfilling our obligations to you because of things 
or events that are outside of our control. This includes, but is not limited to: 
o involuntary interruptions outside of our control such as electricity failures or blackouts or the unavailability of 
any telecommunications system or networks; 
o government actions; or",C:\Users\l\Documents\Banking-rag\data\product_terms\StandardTermsandConditions.pdf,product_terms
"o involuntary interruptions outside of our control such as electricity failures or blackouts or the unavailability of 
any telecommunications system or networks; 
o government actions; or 
o wars, fires, floods, strikes, civil unrest, epidemics.  
• In such cases we will not be responsible for any failure to perform any of our obligations to you or any person  
(including users of our  platform), and our obligations will be suspended, for as long as such interruptions 
continue. We may if we choose to , where possible, give you prior notice of interruptions and changes, but we 
have no duty to do so.  
• Without limiting the clauses before, we will not be legally responsible to you  or any person for any loss, costs, 
expenses, damages, or any claims, lawsuits, demands, of any kind whatsoever, whether brought by an individual 
or any entity, because of any service interruptions that were beyond our reasonable control. 
14. PREVENTION OF HARM AND EXCLUSION OF LIABILITY",C:\Users\l\Documents\Banking-rag\data\product_terms\StandardTermsandConditions.pdf,product_terms
"or any entity, because of any service interruptions that were beyond our reasonable control. 
14. PREVENTION OF HARM AND EXCLUSION OF LIABILITY 
• Although we take reasonable care to prevent harm or loss to you, we will not be liable for any kind of loss or 
damage you may suffer, including direct, indirect, special, incidental or consequential damages, because of your 
use of, or inability to use, the platform, interfaces, channels or solutions.",C:\Users\l\Documents\Banking-rag\data\product_terms\StandardTermsandConditions.pdf,product_terms
"Version updated 20 March 2025 
• TAKE NOTE:  We are not liable for the following: 
o any loss or damage, which you or any other party may suffer due to unauthorised interception or  
surveillance; 
o any loss or damage if you did not take reasonable steps to safeguard your account, the PIN or 
passwords, cards, devices or other access mechanisms or follow the steps recommended by us from 
time to time; and 
o late or delayed transactions not caused by our gross negligence.",C:\Users\l\Documents\Banking-rag\data\product_terms\StandardTermsandConditions.pdf,product_terms
"Version updated 20 March 2025 
15. PREVENTION OF CRIMINAL ACTIVITIES AND TERMINATION OF CUSTOMER RELATIONSHIP 
• In this clause, references to “we”, “us” or “our” are references to the entities in the FirstRand Group of companies (which 
includes but is not limited to FirstRand Bank Limited (Registration Number 1929/001225/06) (and acting through any of 
its divisions), and all affiliates, associates, cessionaries, delegates and successors in title. 
• The entities within the FirstRand Group of companies (as defined in the FirstRand Group Customer Privacy Notice and 
which can be found on the FirstRand website or you can contact us to request a copy) try to stop or prevent criminal 
activities including ta x crimes, money laundering, terrorist financing, weapons proliferation financing and international 
sanctions circumvention and are obligated in terms of its regulatory requirements to start measures to prevent these.",C:\Users\l\Documents\Banking-rag\data\product_terms\StandardTermsandConditions.pdf,product_terms
"sanctions circumvention and are obligated in terms of its regulatory requirements to start measures to prevent these.  
• You must use our solutions, interfaces and channels in compliance with all applicable laws and our requirements including 
but not limited to preventing bribery and corruption, human trafficking, money laundering, terrorist financing, weapons 
proliferation financing, tax crimes and avoidance, counterterrorism and local (from any country) and international 
sanctions.  
• In keeping with our legal and regulatory obligations and in line with our contractual rights, the FirstRand group of 
companies may: 
o choose the customers we wish to do business with;  
o identify risks that customers may expose the group to; and 
o within our discretion, may decide whether the banking relationship should continue.  
• These decisions will always be carefully considered, and we will not make decisions based on grounds which are not",C:\Users\l\Documents\Banking-rag\data\product_terms\StandardTermsandConditions.pdf,product_terms
"• These decisions will always be carefully considered, and we will not make decisions based on grounds which are not 
allowed such as race, nationality, gender, or religion. 
• Various laws, including but not limited to the Financial Intelligence Centre Act, 2001 as amended (FICA) requires that we 
know and understand our customers.  
• We also need to manage our risk exposure, including reputational risk, in a responsible manner. To manage risk as 
needed, we identify and monitor any risk that our business relationships may pose to us on an ongoing basis. 
• As a result of this, the FirstRand group of companies can do any of the following things if we consider it necessary to do 
so, or domestic laws or international laws, rules, regulations, restrictions or policies require us to do so: 
o We may check and confirm the identity of any customer and entity as well as that of any related persons to or",C:\Users\l\Documents\Banking-rag\data\product_terms\StandardTermsandConditions.pdf,product_terms
"o We may check and confirm the identity of any customer and entity as well as that of any related persons to or 
acting on behalf of or involved with such customers or entities and of any recipients of funds regardless of 
where they bank. This includes, but is not limited to, mandated persons, directors, trustees, signatories, ultimate 
beneficial owners, members, shareholders and related entities or persons. We will do this at the start of the 
business relationship and as often as we or the law considers neces sary thereafter. We may also request, 
check and confirm information related to source of funds and any other information which we may reasonably 
need.",C:\Users\l\Documents\Banking-rag\data\product_terms\StandardTermsandConditions.pdf,product_terms
"Version updated 20 March 2025 
o We are obligated to monitor any transactions and instructions on your solutions at the beginning and/or on a 
continuing basis. 
o We can request further information to verify the transaction, source of funds, instruction or beneficiary before 
acting on any instruction or transaction in accordance with various laws. This may result in a delay in us carrying 
out the instruction or transaction. 
o We may refuse to carry out any instruction or transaction. 
o We may refuse to do business with any person or entity where we consider their behaviour or associations to 
be outside of our risk appetite or where they are involved in ethically sensitive activities, as determined by us. 
o We will not willingly and knowingly do business with any person or entity:  
•   that appears on any sanction list, as set out by legislation or used by us in the management of our",C:\Users\l\Documents\Banking-rag\data\product_terms\StandardTermsandConditions.pdf,product_terms
"o We will not willingly and knowingly do business with any person or entity:  
•   that appears on any sanction list, as set out by legislation or used by us in the management of our 
risk, including any person or entity who facilitates or is involved in activities with sanctioned persons,  
•   deals with high-risk countries,  
•   who is in any way linked to any person or entity that appears on such sanction list, 
•   is linked to any restricted countries or the government agencies of such restricted countries as 
determined from time to time. 
o In the case of fraud, suspected fraud, or where the law requires us, we can freeze your solution or terminate 
the banking relationship or service, or we can decline receipt of funds or refuse to carry out any instruction or 
transaction without notice to you. Fraud or suspected fraud includes (but is not limited to) instances where you",C:\Users\l\Documents\Banking-rag\data\product_terms\StandardTermsandConditions.pdf,product_terms
"transaction without notice to you. Fraud or suspected fraud includes (but is not limited to) instances where you 
receive funds through misrepresentation; you allow your solution to be used by a third party for fraudulent 
purposes such as a mule account or you provide false or not enough information to us. Please refer to the 
Security Centre tab on our Apps and websites for more information on the different types of fraud. 
o We can terminate or temporarily restrict our relationship with you or your applicable solution (subject to the 
solution agreement) if we are made to do so by law or if we have reason to believe that a continued relationship 
will expose us to reputational, business or any other risk which may be outside of our risk appetite. Risk appetite 
means the level or type of risk we are prepared to accept, from time to time. 
o Where we choose to terminate the relationship, and to the extent permitted by law, we will provide you with",C:\Users\l\Documents\Banking-rag\data\product_terms\StandardTermsandConditions.pdf,product_terms
"means the level or type of risk we are prepared to accept, from time to time. 
o Where we choose to terminate the relationship, and to the extent permitted by law, we will provide you with 
reasonable notice of termination.  
o You may also terminate the relationship with us, or your applicable solution (subject to the solution agreement). 
o We will, to the extent possible, provide reasonable assistance to you to close, terminate or transfer to another 
bank a solution upon us receiving a request from you for us to do so. We will not impose any unreasonable 
barriers to you in these circumstances.",C:\Users\l\Documents\Banking-rag\data\product_terms\StandardTermsandConditions.pdf,product_terms
"Version updated 20 March 2025 
o We can monitor any transactions and instructions on your solutions at inception and/or on a continuing basis.  
o We can place a hold on any account, facility or solution. 
• You agree to assist us to comply with the law and our internal risk requirements by providing us with all the information 
and documents we need. If you fail to do so or provide false or inadequate information or if the information you provide 
is outdated, we can refuse to enter into a relationship with you, refuse to carry out an instruction (including an instruction 
to transfer available funds and close a solution), suspend access to your participation in and the use of any rewards 
and/or customer benefits  associated with any solution, restrict access to your solution, our channels and interfaces by 
placing a hold on your solution and can also terminate our relationship with you.",C:\Users\l\Documents\Banking-rag\data\product_terms\StandardTermsandConditions.pdf,product_terms
"placing a hold on your solution and can also terminate our relationship with you.  
• TAKE NOTE: While we do our best to provide service to you, there might be certain situations beyond our control 
in providing these services. If we need to take actions to comply with the law, or if a foreign bank is unable to 
carry out an instruction due t o their policies or governmental regulations, we unfortunately cannot take 
responsibility for any resulting loss or inconvenience to you.  
• IMPORTANT: Our Guide and all necessary documents containing the circumstances that may lead to our refusal 
to provide a solution or render a financial service, or the withdrawal, termination or closure of a solution or 
withdrawal or termination of a financ ial service, is available on our Apps and websites. Alternatively, you can 
contact us to request a copy. Please refer to the Legal tab on our Apps and websites to access these documents.",C:\Users\l\Documents\Banking-rag\data\product_terms\StandardTermsandConditions.pdf,product_terms
"contact us to request a copy. Please refer to the Legal tab on our Apps and websites to access these documents.  
16. ADMINISTRATION, DEBT REVIEW, INSOLVENCY, SEQUESTRATION AND BUSINESS RESCUE 
• You must tell us immediately if you apply for, are placed under , an administration order , debt review, sequestrated, 
liquidated, placed under business rescue, judicial management, curatorship, receivership or any similar limitation is 
applied to you  (whether provisional or final) , or any government agency exercises any resolution powers or option in 
respect of you or you  become legally incompetent , is deregistered  or is in the process of deregistration, or failed to 
maintain your corporate identity, dissolves or if you cease to conduct business in the ordinary course. 
• If you are sequestrated, liquidated, wound-up, deregistered, failed to maintain your corporate identity, dissolved, or any",C:\Users\l\Documents\Banking-rag\data\product_terms\StandardTermsandConditions.pdf,product_terms
"• If you are sequestrated, liquidated, wound-up, deregistered, failed to maintain your corporate identity, dissolved, or any 
similar limitation is applied to you (whether provisional or final) the full amount you owe us will be payable and access to 
any money in your solutions will be restricted. 
• If you pass away, the full amount you owe us will be payable and third-party access to any money in your solutions will 
be restricted. 
17. CERTIFICATES OF BALANCE AND RECORDS 
• If we need to take legal action against you, one of our authorised employees whose authority need not be proved  will 
produce a certificate, which shows the amount you owe us. If you do not agree with this certificate, you will have to prove 
that it is wrong. 
• If there is a dispute about any matter or record, our records  certified as correct by any authorised employee whose 
authority need not be proved, will serve on the face of it as proof. This means it will be treated as correct unless you can",C:\Users\l\Documents\Banking-rag\data\product_terms\StandardTermsandConditions.pdf,product_terms
"authority need not be proved, will serve on the face of it as proof. This means it will be treated as correct unless you can 
prove it is wrong. 
18. SET-OFF 
•  Where the law gives us the right, we may:  
o Place your money (credits) on hold until we have a discussion with you about any amount you owe us.",C:\Users\l\Documents\Banking-rag\data\product_terms\StandardTermsandConditions.pdf,product_terms
"Version updated 20 March 2025 
o Set-off any outstanding amounts that are due and payable by you to us against money (credits) in other solution 
accounts you have with us. 
• We will notify you if we apply set-off. 
19. JURISDICTION AND COSTS 
• We can take legal action against you in a Magistrates’ Court or lower court that has jurisdiction. We may also take legal 
action against you in the High Court, Supreme Court or any other competent court with jurisdiction in our sole discretion. 
• You agree that we may charge legal and collection fees, stamp duty, costs and charges and taxes to your solution and 
that it will form part of the outstanding balance. 
• You will be liable for our legal fees, costs and charges we demand subject to any requirements of the law . Such costs 
may include, but are not limited to, tracing costs, collection commission, legal costs to issue and serve summons, obtain",C:\Users\l\Documents\Banking-rag\data\product_terms\StandardTermsandConditions.pdf,product_terms
"may include, but are not limited to, tracing costs, collection commission, legal costs to issue and serve summons, obtain 
judgment, issue warrants or writs, effect attachment and arrange a sale in execution, disbursements and sheriff’s/bailiff’s 
fees. 
• These fees, costs and charges remain due, owing and payable by you until settled in full. 
20.  CHANGES TO THESE STANDARD TERMS AND CONDITIONS 
• No changes to these Standard T & Cs  and no waiver (giving up) of any of our rights will be binding on us unless it is 
recorded in writing and signed or issued or accepted by our authorised representatives. 
• We may change or update these Standard T & Cs at any time.  Changes may be required for reasons including (1) new 
regulations or regulator guidance has been introduced or existing regulations or regulator guidance has changed; (2) we 
updated or changed our interfaces , channels or solutions; (3) we introduced new ways in which to combat fraud; or (4)",C:\Users\l\Documents\Banking-rag\data\product_terms\StandardTermsandConditions.pdf,product_terms
"updated or changed our interfaces , channels or solutions; (3) we introduced new ways in which to combat fraud; or (4) 
changes in technology or our processes or industry standards.   
• Where the changes are in our view important, we will notify you of the changes via the interface, channel or by sending 
a notice to you, for example a letter, e -mail, SMS or App Push Notification. A change will be regarded as important if 
such change may have a significant impact on you including your rights, a change that could lead to a penalty to you or 
a change to the relationship between us.  Your continued use of our interfaces, channels and solutions will be regarded 
as an acceptance of the change. 
• If you do not want to accept any of the changes, you may cancel your whole relationship with us by cancelling and settling 
each solution agreement in accordance with  the terms specified in the solution agreement. Termination of a solution",C:\Users\l\Documents\Banking-rag\data\product_terms\StandardTermsandConditions.pdf,product_terms
"each solution agreement in accordance with  the terms specified in the solution agreement. Termination of a solution 
agreement shall only take effect once all obligations in terms of the applicable solution agreement are complete. 
• Changes will only apply to rights and obligations from the date of the change going forward. 
21. VALUE-ADDS 
• To qualify for any value -added solutions, your FirstRand group of companies’ relationship must be in good standing. 
Good standing means that none of your solutions should be overdrawn, or be in arrears, or be in default, or be subject 
to any legal process with the FirstRand group of companies.  
• Legal process means any legal proceedings in any court of law involving you and the FirstRand group of companies 
including but not limited to business rescue, judicial management, curatorship, receivership, collections, liquidation, 
administration, wounding-up and sequestration proceedings.",C:\Users\l\Documents\Banking-rag\data\product_terms\StandardTermsandConditions.pdf,product_terms
"including but not limited to business rescue, judicial management, curatorship, receivership, collections, liquidation, 
administration, wounding-up and sequestration proceedings.  
• For the purposes of this clause, legal process will exclude debt review, but this will still have an effect on the qualifying  
criteria of all value-added solutions.",C:\Users\l\Documents\Banking-rag\data\product_terms\StandardTermsandConditions.pdf,product_terms
"Version updated 20 March 2025 
22. BREACH OF CONTRACT 
• In the event of either party committing a breach of any of these Standard T&Cs, the non-breaching party may give notice, 
provided that such breach is capable of being remedied, to the party in breach to remedy such breach within a period of 
7 calendar days after receipt of the written notice. 
• If the breaching party fails to remedy the breach within the notice period, the non-breaching party may, in its sole 
discretion and without prejudice to any of its other rights in law, either claim specific performance, or cancel these 
Standard T&Cs on immediate written notice. 
• In addition, the non-breaching party shall be entitled to claim and recover damages from the breaching party.  
• We may cancel these Standard T&Cs at any time on immediate written notice to you if: 
o you commit a breach of these Standard T&Cs which cannot be remedied;",C:\Users\l\Documents\Banking-rag\data\product_terms\StandardTermsandConditions.pdf,product_terms
"• We may cancel these Standard T&Cs at any time on immediate written notice to you if: 
o you commit a breach of these Standard T&Cs which cannot be remedied; 
o you are, other than for the purposes of reconstruction or amalgamation, placed under voluntary or compulsory 
liquidation, winding -up, business rescue , judicial management , placed under curatorship, receivership , 
deregistered or the equivalent of any of these in any jurisdiction; 
o a judgment against you for which no appeal lies or for which the period for lodging an appeal (excluding any 
period to seek condonation) has expired and remains unsatisfied for a period of at least 30 calendar days;  
o you make or offer to make a general assignment or any arrangement or composition with or for the benefit of 
your creditors generally (or any class of its creditors) for releasing you wholly or partially from your debts;  
o you are or become a sanctioned entity;",C:\Users\l\Documents\Banking-rag\data\product_terms\StandardTermsandConditions.pdf,product_terms
"your creditors generally (or any class of its creditors) for releasing you wholly or partially from your debts;  
o you are or become a sanctioned entity; 
o you contravene any sanctions or are placed on any sanctions list by any sanction’s authority; or 
o participate in, facilitate, are or become the beneficiary of any sanctioned transaction. 
23. ASSIGNMENT, CESSION AND DELEGATION 
• You may not cede, assign, transfer or make over any rights or delegate any obligations in terms of these Standard T&Cs.  
• You consent to any cession of our rights and to any delegation of our obligations including security held under  these 
Standard T & Cs.  
• You agree to splitting of claims which may arise as a result of a cession and/or delegation by us as contemplated in these 
Standard T&Cs.  
• Without notice to you, we (or any person to whom our rights and obligations are ceded, delegated and assigned) will be",C:\Users\l\Documents\Banking-rag\data\product_terms\StandardTermsandConditions.pdf,product_terms
"Standard T&Cs.  
• Without notice to you, we (or any person to whom our rights and obligations are ceded, delegated and assigned) will be 
allowed to cede, delegate and assign any or all of our rights and obligations under these Standard T&Cs, either absolutely 
or as collateral security to any third party.  
• If any agreement and document must be entered into by or on your behalf about the cession or delegation, you agree to 
action either your signature or acceptance upon our request.  
• Upon cession, delegation and assignment  and on notice to you, you must make payment directly to the cessionary, 
without any set-off, deduction or withholding.  
• You agree that we may share  these Standard T&Cs  and information about you with any person to whom we cede, 
delegate and assign our rights and obligations under these Standard T&Cs.  
• If these Standard T&Cs are ceded and delegated (assigned) to another, the payment instruction may also be ceded and",C:\Users\l\Documents\Banking-rag\data\product_terms\StandardTermsandConditions.pdf,product_terms
